{
  "schema": "sfb.mesh.v1",
  "vertex_count": 4,
  "triangle_count": 2,
  "vertices": [
    [
      -4.0,
      0.0,
      0.0
    ],
    [
      4.0,
      0.0,
      0.0
    ],
    [
      -4.0,
      4.0,
      0.0
    ],
    [
      4.0,
      4.0,
      0.0
    ]
  ],
  "triangles": [
    [
      0,
      2,
      1
    ],
    [
      1,
      2,
      3
    ]
  ],
  "normals": [
    [
      0.0,
      0.0,
      -1.0
    ],
    [
      0.0,
      0.0,
      -1.0
    ],
    [
      0.0,
      0.0,
      -1.0
    ],
    [
      0.0,
      0.0,
      -1.0
    ]
  ],
  "uv": [
    [
      0.0,
      0.0
    ],
    [
      1.0,
      0.0
    ],
    [
      0.0,
      1.0
    ],
    [
      1.0,
      1.0
    ]
  ],
  "bounds": {
    "min": [
      -4.0,
      0.0,
      0.0
    ],
    "max": [
      4.0,
      4.0,
      0.0
    ]
  }
}